{
  "$schema": "https://json-schema.org/draft/2020-12/schema",
  "$id": "https://github.com/terajuciptabina-eng/terajuciptabina/blob/main/data/contractors/record.schema.json",
  "title": "Teraju Ciptabina Contractor Planner Record",
  "description": "Canonical schema for one contractor planner record. The same schema validates both build.json and renovation.json records.",
  "type": "object",
  "required": [
    "schemaVersion",
    "contractorId",
    "contractorName",
    "state",
    "projectType",
    "updatedAt",
    "items"
  ],
  "properties": {
    "schemaVersion": {
      "type": "integer",
      "const": 1
    },
    "contractorId": {
      "type": "string",
      "minLength": 3
    },
    "contractorName": {
      "type": "string",
      "minLength": 1
    },
    "state": {
      "type": "string",
      "minLength": 2
    },
    "projectType": {
      "type": "string",
      "enum": [
        "build",
        "renovation"
      ]
    },
    "updatedAt": {
      "type": "string",
      "format": "date-time"
    },
    "items": {
      "type": "array",
      "items": {
        "$ref": "#/$defs/item"
      }
    }
  },
  "$defs": {
    "item": {
      "type": "object",
      "required": [
        "id",
        "contractorId",
        "contractorName",
        "state",
        "projectType",
        "itemId",
        "description",
        "unit",
        "rate",
        "quantity",
        "included",
        "active",
        "updatedAt"
      ],
      "properties": {
        "id": {
          "type": "string",
          "minLength": 1
        },
        "contractorId": {
          "type": "string",
          "minLength": 3
        },
        "contractorName": {
          "type": "string",
          "minLength": 1
        },
        "state": {
          "type": "string",
          "minLength": 2
        },
        "projectType": {
          "type": "string",
          "enum": [
            "build",
            "renovation"
          ]
        },
        "itemId": {
          "type": "string",
          "minLength": 1
        },
        "description": {
          "type": "string",
          "minLength": 1
        },
        "unit": {
          "type": "string",
          "minLength": 1
        },
        "rate": {
          "type": "number",
          "minimum": 0
        },
        "quantity": {
          "type": "number",
          "minimum": 0
        },
        "included": {
          "type": "boolean"
        },
        "active": {
          "type": "boolean"
        },
        "updatedAt": {
          "type": "string",
          "format": "date-time"
        }
      },
      "additionalProperties": false
    }
  },
  "additionalProperties": false
}
