{
  "schemaVersion": 1,
  "contractorId": "CTR-XXXXXXXX",
  "contractorName": "Contractor Name",
  "state": "Selangor",
  "projectType": "build",
  "updatedAt": "2026-09-07T00:00:00.000Z",
  "items": [
    {
      "id": "example-item",
      "contractorId": "CTR-XXXXXXXX",
      "contractorName": "Contractor Name",
      "state": "Selangor",
      "projectType": "build",
      "itemId": "example-item",
      "description": "Example construction item",
      "unit": "sqft",
      "rate": 0,
      "quantity": 1,
      "included": true,
      "active": true,
      "updatedAt": "2026-09-07T00:00:00.000Z"
    }
  ]
}
